<?xml version="1.0" encoding="UTF-8"?>
<grupo id="1" xmlns:xsi="http://www.w3.org/2001/XMLSchema-instance" xsi:noNamespaceSchemaLocation= "grupo.xsd">
    <nombre_grupo>Aerosmith</nombre_grupo>
    <integrantes>
        <nombre>Joe Perry</nombre>
        <nombre>Steven Tyles</nombre>
        <nombre>Tom Hamilton</nombre>
        <nombre>Joey Kramer</nombre>
        <nombre>Ray Tabano</nombre>
    </integrantes>
    <album id ="1">
        <nombre>Aerosmith</nombre>
        <discografica>Columbia Records</discografica>
        <canciones>
            <cancion>Make it</cancion>
            <cancion>Dream on</cancion>
        </canciones>
        <anio>1973</anio>
        <dedicatoria a_quien="Todos">
            Se agradece a todos!!!
        </dedicatoria>
        <dedicatoria a_quien="Madre">Te quiero!!!</dedicatoria>
    </album>
    <pais>EEUU</pais>
    <anio_formacion aÃ±o="1970" />
    <discos_vendidos>200 millones</discos_vendidos>
    <genero>Rock</genero>
    <concierto_mas_costoso precio="12.32" />
    <estado_activo />
</grupo>
